{
  "stage": "inception",
  "status": "active",
  "phase": "elaborate",
  "started_at": "2026-04-30T17:51:01Z",
  "completed_at": null,
  "gate_entered_at": null,
  "gate_outcome": null,
  "visits": 1,
  "iterations": [
    {
      "index": 1,
      "started_at": "2026-04-30T17:51:02Z",
      "completed_at": null,
      "trigger": "initial",
      "result": null
    }
  ]
}
