{
  "stage": "operations",
  "status": "completed",
  "phase": "gate",
  "started_at": "2026-04-24T03:54:51Z",
  "completed_at": "2026-04-24T12:51:43Z",
  "gate_entered_at": null,
  "gate_outcome": "advanced",
  "visits": 1,
  "iterations": [
    {
      "index": 1,
      "started_at": "2026-04-24T03:54:51Z",
      "completed_at": "2026-04-24T12:51:43Z",
      "trigger": "initial",
      "result": "advanced"
    }
  ],
  "pre_review_dispatched": true,
  "pre_review_dispatched_at": "2026-04-24T03:55:01Z",
  "pre_review_reviewers_acknowledged": true,
  "pre_review_reviewers_acknowledged_at": "2026-04-24T03:59:54Z"
}
